{
  "layout_schema_version": "furniture-layout-1",
  "layout_id": "slice-005-acceptance-variant-c",
  "room_id": "living-room-main",
  "units": "m",
  "coordinate_system": "canonical_room",
  "placement_method": "manual",
  "items": [
    {
      "id": "sofa",
      "type": "sofa",
      "dimensions_m": [2.4, 0.95, 0.85],
      "dimensions_status": "synthetic",
      "source_id": "slice-005-acceptance-sofa",
      "position_xy_m": [-3.1, 1.2],
      "anchor": "bottom_center",
      "yaw_deg": 0.0
    },
    {
      "id": "coffee_table",
      "type": "coffee_table",
      "dimensions_m": [1.0, 0.6, 0.4],
      "dimensions_status": "synthetic",
      "source_id": "slice-005-acceptance-coffee-table",
      "position_xy_m": [-3.1, 0.2],
      "anchor": "bottom_center",
      "yaw_deg": 90.0
    },
    {
      "id": "floor_proxy",
      "type": "shelf",
      "dimensions_m": [0.5, 0.5, 0.5],
      "dimensions_status": "synthetic",
      "source_id": "slice-005-acceptance-floor-proxy",
      "position_xy_m": [0.5, 1.0],
      "anchor": "bottom_center",
      "yaw_deg": 0.0
    }
  ]
}
