{
  "layout_schema_version": "furniture-layout-1",
  "layout_id": "fixture-synthetic-01",
  "room_id": "living-room-main",
  "units": "m",
  "coordinate_system": "canonical_room",
  "placement_method": "manual",
  "items": [
    {
      "id": "sofa-01",
      "type": "sofa",
      "dimensions_m": [2.2, 0.95, 0.85],
      "dimensions_status": "synthetic",
      "source_id": "slice-004-fixture-sofa",
      "position_xy_m": [-3.1, 1.2],
      "anchor": "bottom_center",
      "yaw_deg": 0.0
    },
    {
      "id": "coffee-table-01",
      "type": "coffee_table",
      "dimensions_m": [1.0, 0.6, 0.4],
      "dimensions_status": "synthetic",
      "source_id": "slice-004-fixture-coffee-table",
      "position_xy_m": [-3.1, 0.2],
      "anchor": "bottom_center",
      "yaw_deg": 90.0
    },
    {
      "id": "armchair-01",
      "type": "armchair",
      "dimensions_m": [0.8, 0.8, 0.9],
      "dimensions_status": "synthetic",
      "source_id": "slice-004-fixture-armchair",
      "position_xy_m": [-1.0, 1.2],
      "anchor": "bottom_center",
      "yaw_deg": 270.0
    }
  ]
}
